company_id,record_ids,employer_name,fair_days,fair_day_count,is_multi_day_company,website,company_careers_website,description,positions_recruited,degree_levels_recruited,academic_years_recruited,academic_year_recruitment_notes,degrees_majors_recruited,work_authorization_sponsorship,work_authorization_notes,sponsorship_flag,sponsorship_status,sponsorship_basis,sponsorship_evidence,regions_recruited,accept_hardcopy_resumes,role_titles,role_source_url,role_last_checked
kimberly_clark,kimberly_clark__tuesday,Kimberly-Clark,Tuesday,1,False,https://www.kimberly-clark.com/,https://careers.kimberly-clark.com/en,"Huggies®. Kleenex®. Cottonelle®. Scott®. Kotex®. Poise®. Depend®. Kimberly-Clark Professional®. You already know our legendary brands—and so does the rest of the world. In fact, millions of people use Kimberly-Clark products every day. We know that these amazing Kimberly-Clark products wouldn’t exist without talented professionals, like you.","Co-op, Full-Time, Internship",Bachelors,"Second year undergraduate student, Third year undergraduate student, Fourth year + undergraduate student, First year undergraduate student",,"Bachelors Biomedical Engineering, Bachelors Chemical Engineering, Bachelors Computer Engineering, Bachelors Electrical Engineering, Bachelors Industrial and Operations Engineering, Bachelors Mechanical Engineering",Authorized to work in the United States and WILL NOT require future sponsorship,,No,No,default_no_explicit_sponsorship,Authorized to work in the United States and WILL NOT require future sponsorship,"Midwest, Northeast, Southeast, Southwest",True,,,
klein_and_hoffman,klein_and_hoffman__tuesday,Klein and Hoffman,Tuesday,1,False,www.kleinandhoffman.com,www.kleinandhoffman.com,Klein and Hoffman is a Architecture and Structural Engineer firm headquarters are in Chicago. We have 75 employees.,"Full-Time, Internship","Bachelors, Masters","Fourth year + undergraduate student, Masters level student, Recent Alumni (up to two years post graduation), Third year undergraduate student","Recruiting for Internship, and Associate I","Bachelors Civil Engineering, Masters Civil Engineering",Authorized to work in the United States and WILL NOT require future sponsorship,,No,No,default_no_explicit_sponsorship,Authorized to work in the United States and WILL NOT require future sponsorship,Midwest,True,,,
koch_finishing_systems,koch_finishing_systems__tuesday,Koch Finishing Systems,Tuesday,1,False,https://www.kochllc.com,https://www.kochllc.com/careers,"KOCH Finishing Systems, designs, engineers, fabricates, installs, commissions, and services automated finishing systems for all major coating technologies, including liquid, powder, electrocoat, anodizing, and plating. Electrical Engineering opportunities focused on the design, programming, installation, and commissioning of automated finishing equipment. Candidates will apply their expertise in PLC programming, HMI development, and electrical system design to deliver innovative, customer-focused solutions. Mechanical Engineering roles involve designing and engineering custom automated machinery, creating detailed 3D models, assemblies, and technical drawings using CAD software to ensure high-quality, specification-compliant solutions.","Co-op, Full-Time, Internship",Bachelors,"Second year undergraduate student, Third year undergraduate student, Fourth year + undergraduate student, Recent Alumni (up to two years post graduation)","Internships for students entering their third or fourth year of undergraduate, full-time opportunities for new graduates.","Bachelors Electrical Engineering, Bachelors Mechanical Engineering",Authorized to work in the United States and WILL NOT require future sponsorship,,No,No,default_no_explicit_sponsorship,Authorized to work in the United States and WILL NOT require future sponsorship,Midwest,True,,,
konecranes,konecranes__tuesday,Konecranes,Tuesday,1,False,https://www.konecranes.com/,https://konecranes.careers/,"We are a global leader in material handling solutions, serving a broad range of customers across multiple industries. Konecranes consistently sets the industry benchmark, from everyday improvements to the breakthroughs at moments that matter most, because we know we can always find a safer, more productive and sustainable way. That’s why, with around 16,000 professionals in over 50 countries, Konecranes is trusted every day to lift, handle and move what the world needs. Konecranes shares are listed on Nasdaq Helsinki (symbol: KCR).",Full-Time,Bachelors,Fourth year + undergraduate student,,"Bachelors Mechanical Engineering, Bachelors Electrical Engineering, Bachelors Biomedical Engineering",Authorized to work in the United States and WILL NOT require future sponsorship,,No,No,default_no_explicit_sponsorship,Authorized to work in the United States and WILL NOT require future sponsorship,"Midwest, Southwest",True,,,
l_and_l_products,l_and_l_products__tuesday,L&L Products,Tuesday,1,False,https://www.llproducts.com/,https://fa-eosa-saasfaprod1.fa.ocs.oraclecloud.com/hcmUI/CandidateExperience/en/sites/CX_3001/jobs,"We are proud to be an innovative development partner to a vast customer base, providing them with unique material formulations and engineering solutions for lighter, stronger, quieter products.","Full-Time, Internship","Bachelors, Doctoral, Masters","Doctoral level student, Fourth year + undergraduate student, Masters level student, First year undergraduate student, Second year undergraduate student, Third year undergraduate student",Internships for Summer 2026,"Bachelors Chemical Engineering, Bachelors Mechanical Engineering, Doctoral Chemical Engineering, Doctoral Materials Science and Engineering, Bachelors Materials Science and Engineering, Masters Chemical Engineering, Masters Materials Science and Engineering",Authorized to work in the United States and WILL NOT require future sponsorship,,No,No,default_no_explicit_sponsorship,Authorized to work in the United States and WILL NOT require future sponsorship,Midwest,True,,,
lear_corporation,lear_corporation__tuesday,Lear Corporation,Tuesday,1,False,https://www.lear.com,https://www.lear.com/careers,"With more than 100 years of heritage, Lear is the largest U.S.-based automotive supplier, shaping the future of mobility through Seating and E-Systems innovations.",Internship,Bachelors,"Third year undergraduate student, Second year undergraduate student","Undergraduate Sophomore, Junior, Senior","Bachelors Chemical Engineering, Bachelors Computer Engineering, Bachelors Computer Science, Bachelors Electrical Engineering, Bachelors Engineering (undeclared), Bachelors Industrial and Operations Engineering, Bachelors Mechanical Engineering, Bachelors Materials Science and Engineering",Authorized to work in the United States and WILL NOT require future sponsorship,,No,No,default_no_explicit_sponsorship,Authorized to work in the United States and WILL NOT require future sponsorship,Midwest,True,,,
leidos,leidos__monday,Leidos,Monday,1,False,https://www.leidos.com/,https://careers.leidos.com,"Leidos is a 48,000 employee industry and technology leader serving government and commercial customers with smarter, more efficient digital and mission innovations. We help customers execute on important missions on the front lines of the world's most complex markets.","Co-op, Full-Time, Internship","Bachelors, Doctoral, Masters","First year undergraduate student, Fourth year + undergraduate student, Masters level student, Second year undergraduate student, Third year undergraduate student, Doctoral level student",,"Bachelors Aerospace Engineering, Bachelors Civil Engineering, Bachelors Computer Engineering, Bachelors Computer Science, Bachelors Data Science, Bachelors Electrical Engineering, Bachelors Engineering (undeclared), Bachelors Industrial and Operations Engineering, Bachelors Mechanical Engineering, Doctoral Aerospace Engineering, Doctoral Civil Engineering, Masters Aerospace Engineering, Masters Civil Engineering, Masters Electrical and Computer Engineering, Masters Electrical Engineering, Masters Electrical Engineering-Systems, Masters Mechanical Engineering, Bachelors Naval Architecture and Marine Engineering",Authorized to work in the United States and WILL NOT require future sponsorship,,No,No,default_no_explicit_sponsorship,Authorized to work in the United States and WILL NOT require future sponsorship,"Remote work opportunities may be available, West, Southwest, Southeast, Northeast, Midwest",True,,,
lubrizol,lubrizol__tuesday,Lubrizol,Tuesday,1,False,www.lubrizol.com,www.lubrizol.com/careers,"Lubrizol, a Berkshire Hathaway company, is a technology-driven global company that combines complex, specialty chemicals to optimize the quality, performance and value of customers’ products while reducing their environmental impact. Lubrizol produces and supplies technologies to customers in the global transportation, industrial and consumer markets. These technologies include lubricant additives for engine oils, driveline and other transportation-related fluids, industrial lubricants, and additives for gasoline and diesel fuel. In addition, Lubrizol makes ingredients and additives for home care and personal care products and pharmaceuticals, and specialty materials, including plastics technology and performance coatings in the form of resins and additives.","Co-op, Internship","Bachelors, Masters","First year undergraduate student, Second year undergraduate student, Masters level student",,"Bachelors Chemical Engineering, Bachelors Biomedical Engineering, Bachelors Computer Engineering, Bachelors Computer Science, Bachelors Data Science, Bachelors Environmental Engineering, Bachelors Mechanical Engineering, Masters Data Science",Authorized to work in the United States and WILL NOT require future sponsorship,,No,No,default_no_explicit_sponsorship,Authorized to work in the United States and WILL NOT require future sponsorship,"Midwest, Southwest, Northeast, Southeast",True,,,
mit_lincoln_laboratory,mit_lincoln_laboratory__tuesday,MIT Lincoln Laboratory,Tuesday,1,False,https://www.ll.mit.edu/,https://www.ll.mit.edu/careers,"MIT Lincoln Laboratory is a federally funded research and development center focused on solving problems critical to national security. Our work spans 11 mission areas, including space systems, cybersecurity, advanced sensing, AI, and biotechnology. We offer opportunities for innovative thinkers to develop, test, and apply new technologies in real-world scenarios.","Co-op, Internship","Bachelors, Doctoral, Masters","Doctoral level student, Fourth year + undergraduate student, Masters level student, Second year undergraduate student, Third year undergraduate student","We are recruiting for internship and co-op opportunities open to students entering their second year through doctoral programs. Eligible candidates include rising sophomores, juniors, seniors, master’s students, and PhD students.","Bachelors Aerospace Engineering, Bachelors Chemical Engineering, Bachelors Computer Engineering, Bachelors Computer Science, Bachelors Data Science, Bachelors Electrical Engineering, Bachelors Engineering Physics, Bachelors Industrial and Operations Engineering, Bachelors Materials Science and Engineering, Bachelors Mechanical Engineering, Bachelors Robotics, Bachelors Space Science and Engineering, Doctoral Aerospace Engineering, Doctoral Applied Physics, Doctoral Chemical Engineering, Doctoral Computer Science and Engineering, Doctoral Climate and Space Sciences and Engineering, Doctoral Electrical and Computer Engineering, Doctoral Electrical Engineering, Doctoral Electrical Engineering-Systems, Doctoral Mechanical Engineering, Doctoral Materials Science and Engineering, Doctoral Robotics, Masters Aerospace Engineering, Masters Applied Physics, Masters Chemical Engineering, Masters Data Science, Masters Computer Science and Engineering, Masters Electrical and Computer Engineering, Masters Electrical Engineering, Masters Electrical Engineering-Systems, Masters Energy Systems Engineering, Masters Materials Science and Engineering, Masters Robotics, Masters Space Engineering, Masters Structural Engineering, Masters Systems Engineering and Design",Authorized to work in the United States and WILL NOT require future sponsorship,U.S. citizenship is required. Selected candidates will be subject to a pre-employment background investigation and must be able to obtain and maintain a Secret-level U.S. Department of Defense (DoD) security clearance. We are not able to provide sponsorship for work authorization.,No,No,work_authorization_notes,U.S. citizenship is required. Selected candidates will be subject to a pre-employment background investigation and must be able to obtain and maintain a Secret-level U.S. Department of Defense (DoD) security clearance. We are not able to provide sponsorship for work authorization.,"West, Southwest, Southeast, Northeast, Midwest",False,,,
mach_industries,mach_industries__tuesday,Mach Industries,Tuesday,1,False,machindustries.com,https://www.machindustries.com/careers,"Mach Industries builds next-generation autonomous vehicles and resilient manufacturing infrastructure for modern defense. Our products are designed for speed, scalability, and survivability in the most demanding environments.","Co-op, Full-Time, Internship","Bachelors, Doctoral, Masters","Doctoral level student, Fourth year + undergraduate student, Masters level student, Second year undergraduate student, Third year undergraduate student",,"Bachelors Aerospace Engineering, Bachelors Computer Science, Bachelors Computer Engineering, Bachelors Electrical Engineering, Bachelors Mechanical Engineering, Bachelors Robotics, Doctoral Aerospace Engineering, Doctoral Electrical Engineering, Doctoral Electrical Engineering-Systems, Doctoral Electrical and Computer Engineering, Doctoral Mechanical Engineering, Doctoral Computer Science and Engineering, Doctoral Robotics, Masters Aerospace Engineering, Masters Computer Science and Engineering, Masters Electrical and Computer Engineering, Masters Electrical Engineering, Masters Electrical Engineering-Systems, Masters Mechanical Engineering, Masters Robotics",Authorized to work in the United States and WILL NOT require future sponsorship,,No,No,default_no_explicit_sponsorship,Authorized to work in the United States and WILL NOT require future sponsorship,West,True,,,
manhattan_associates,manhattan_associates__monday,Manhattan Associates,Monday,1,False,https://www.manh.com/,https://www.manh.com/about-us/careers,"At Manhattan, we provide more than just supply chain solutions. We are a team of experienced industry experts dedicated to equipping our partners with the tools needed to navigate the supply chain commerce world effectively. That journey is made possible through our advanced cloud-native technology and collaborating with our partners. We maximize warehouse efficiency so that global leaders can provide essential products to those in need. We get time-sensitive items to their desired locations faster. We orchestrate orders smarter. We unify omnichannel experiences. We connect and innovate every aspect of the supply chain. All working symbiotically toward one common goal: to move life and commerce forward.",Full-Time,Bachelors,"Fourth year + undergraduate student, Third year undergraduate student",,"Bachelors Computer Engineering, Bachelors Computer Science, Bachelors Electrical Engineering, Bachelors Industrial and Operations Engineering, Bachelors Mechanical Engineering",Authorized to work in the United States and WILL NOT require future sponsorship,,No,No,default_no_explicit_sponsorship,Authorized to work in the United States and WILL NOT require future sponsorship,Southeast,False,,,
mathworks,mathworks__monday,MathWorks,Monday,1,False,https://www.mathworks.com,https://www.mathworks.com/company/jobs/students.html,"MathWorks develops MATLAB and Simulink— software that transforms the way engineers and scientists think and work. Every member of the MathWorks team, from marketing to sales and support to business operations to engineering and development, contributes to delivering the software that shapes the things we all rely on in our daily lives. Our users are advancing the world of engineering and science. And we help them do it.","Co-op, Full-Time, Internship","Bachelors, Masters, Doctoral","Masters level student, Third year undergraduate student, Fourth year + undergraduate student, Doctoral level student","Primarily hiring Third and Fourth year students, with Second year students considered with relevant experience","Bachelors Aerospace Engineering, Bachelors Biomedical Engineering, Bachelors Computer Engineering, Bachelors Computer Science, Bachelors Electrical Engineering, Bachelors Mechanical Engineering, Doctoral Aerospace Engineering, Doctoral Biomedical Engineering, Doctoral Applied Physics, Doctoral Computer Science and Engineering, Doctoral Electrical and Computer Engineering, Doctoral Electrical Engineering, Doctoral Mechanical Engineering, Masters Aerospace Engineering, Masters Applied Physics, Masters Biomedical Engineering, Masters Computer Science and Engineering, Masters Electrical and Computer Engineering, Masters Electrical Engineering, Masters Mechanical Engineering","Work visa that will require future sponsorship (e.g., OPT, CPT, J1, etc.), Authorized to work in the United States and WILL NOT require future sponsorship",Able to sponsor for graduate level positions only,Maybe,Limited,work_authorization_notes,Able to sponsor for graduate level positions only,Northeast,False,,,
mccarthy_building_companies,mccarthy_building_companies__monday,McCarthy Building Companies,Monday,1,False,https://www.mccarthy.com/,https://www.mccarthy.com/careers,"With offices and employees nationwide, we specialize in a wide range of project types including healthcare, education, renewable energy, marine, water/wastewater, commercial office and retail, hospitality/entertainment and airports.","Full-Time, Internship","Bachelors, Masters","First year undergraduate student, Fourth year + undergraduate student, Masters level student, Second year undergraduate student, Third year undergraduate student",,"Bachelors Civil Engineering, Bachelors Engineering (undeclared), Bachelors Mechanical Engineering, Masters Civil Engineering",Authorized to work in the United States and WILL NOT require future sponsorship,,No,No,default_no_explicit_sponsorship,Authorized to work in the United States and WILL NOT require future sponsorship,"Midwest, Southwest, Southeast, West",True,,,
meijer_inc,meijer_inc__tuesday,Meijer Inc,Tuesday,1,False,https://www.meijer.com/,https://jobs.meijer.com/,"We opened our doors more than 90 years ago with the goal of helping people provide for themselves and their family. Today we’re a multi-billion dollar retailer with more than 70,000 Team Members across 6 states. Our Midwest geography includes corporate offices in Grand Rapids, Michigan, plus manufacturing facilities, distribution centers, and over 270 stores across Michigan, Illinois, Indiana, Kentucky, Ohio, and Wisconsin.",Internship,Bachelors,"Fourth year + undergraduate student, Second year undergraduate student, Third year undergraduate student",,"Bachelors Computer Science, Bachelors Computer Engineering, Bachelors Data Science",Authorized to work in the United States and WILL NOT require future sponsorship,,No,No,default_no_explicit_sponsorship,Authorized to work in the United States and WILL NOT require future sponsorship,Midwest,True,,,
michigan_department_of_transportation_mdot,michigan_department_of_transportation_mdot__tuesday,Michigan Department of Transportation (MDOT),Tuesday,1,False,https://www.michigan.gov/mdot,https://www.governmentjobs.com/careers/michigan/MDOT,"Our mission is to serve and connect people, communities, and the economy through transportation. The Michigan Department of Transportation (MDOT) is responsible for Michigan's 10,000-mile state highway system.","Internship, Full-Time",Bachelors,"First year undergraduate student, Fourth year + undergraduate student, Third year undergraduate student, Second year undergraduate student, Recent Alumni (up to two years post graduation)","First year, second year, third year, fourth year, and degree holding","Bachelors Civil Engineering, Bachelors Environmental Engineering",Authorized to work in the United States and WILL NOT require future sponsorship,,No,No,default_no_explicit_sponsorship,Authorized to work in the United States and WILL NOT require future sponsorship,"Midwest, Northeast, Southeast, Southwest, West",True,,,
michigan_tech_research_institute,michigan_tech_research_institute__tuesday,Michigan Tech Research Institute,Tuesday,1,False,www.mtu.edu/mtri/,internships - https://www.mtu.edu/mtri/employment/internships/ jobs - https://www.employment.mtu.edu/en-us/filter/?job-mail-subscribe-privacy=agree&search-keyword=&location=michigan%20tech%20research%20institute%20(ann%20arbor%20mi),"MTRI was established in 2006 as a part of Michigan Technological University. MTRI is a recognized leader in the research, development and practical application of sensor and information technology to solve critical problems in national security, protecting and evaluating critical infrastructure, bioinformatics, earth sciences and environmental processes. MTRI has a staff of over 100 professionals and conducts approximately $12 million a year in sponsored research activities. MTRI solely relies on external sponsored funding.","Full-Time, Internship","Bachelors, Doctoral, Masters","Doctoral level student, First year undergraduate student, Fourth year + undergraduate student, Masters level student, Recent Alumni (up to two years post graduation), Second year undergraduate student, Third year undergraduate student",,"Bachelors Aerospace Engineering, Bachelors Biomedical Engineering, Bachelors Computer Engineering, Bachelors Computer Science, Bachelors Data Science, Bachelors Engineering, Bachelors Engineering Physics, Bachelors Environmental Engineering, Bachelors Robotics, Bachelors Space Science and Engineering, Doctoral Aerospace Engineering, Doctoral Atmospheric Oceanic and Space Sciences, Doctoral Biomedical Engineering, Doctoral Climate and Space Sciences and Engineering, Doctoral Computer Science and Engineering, Doctoral Environmental Engineering, Doctoral Electrical Engineering, Doctoral Robotics, Masters Aerospace Engineering, Masters Applied Climate, Masters Biomedical Engineering, Masters Climate and Space Sciences and Engineering, Masters Computer Science and Engineering, Masters Electrical Engineering, Masters Environmental Engineering, Masters Mechanical Engineering, Masters Robotics, Masters Space Engineering",Authorized to work in the United States and WILL NOT require future sponsorship,,No,No,default_no_explicit_sponsorship,Authorized to work in the United States and WILL NOT require future sponsorship,Midwest,True,,,
midea_america_corp,midea_america_corp__monday,Midea America Corp.,Monday,1,False,https://www.midea.com/us,https://app.joinhandshake.com/emp/jobs?page=1&per_page=25&currentView=active,"Our office focuses directly on the innovation, prototyping, and design of new home appliances for the U.S. market. Think consumer insights, consistent testing, CAD, interdisciplinary international teams, and more! If you are looking for a hands-on, innovative experience, our company is for you!","Co-op, Internship","Bachelors, Masters","Fourth year + undergraduate student, Second year undergraduate student, Third year undergraduate student, Masters level student","We are mainly looking for undergraduate students graduating in 2026, 2027, and 2028. Masters and PhD students may apply.","Bachelors Data Science, Bachelors Electrical Engineering, Bachelors Materials Science and Engineering, Bachelors Mechanical Engineering, Masters Electrical Engineering-Systems, Masters Mechanical Engineering, Masters Design Science",Authorized to work in the United States and WILL NOT require future sponsorship,,No,No,default_no_explicit_sponsorship,Authorized to work in the United States and WILL NOT require future sponsorship,Midwest,True,,,
miller_industries_llc,miller_industries_llc__tuesday,"Miller Industries, LLC",Tuesday,1,False,www.millc.com,www.millc.com,"At Miller Industries, we specialize in designing, engineering, and manufacturing custom modular solutions across our four locations in Genesee County, as well as additional offices in Texas and Georgia. Our capabilities include custom steel fabrication, modular mechanical and electrical products, commercial and industrial HVAC systems, and equipment rooms for refrigeration and other critical applications. We proudly serve as primary suppliers to the automotive, healthcare, education, and industrial sectors worldwide and are committed to ongoing growth.","Full-Time, Internship","Bachelors, Masters","Recent Alumni (up to two years post graduation), Second year undergraduate student, Third year undergraduate student, Masters level student, Fourth year + undergraduate student",,"Bachelors Civil Engineering, Bachelors Electrical Engineering, Bachelors Engineering (undeclared), Bachelors Mechanical Engineering, Bachelors Computer Science, Masters Civil Engineering, Masters Computer Science and Engineering, Masters Electrical Engineering, Masters Mechanical Engineering","Authorized to work in the United States and WILL NOT require future sponsorship, Work visa that will require future sponsorship (e.g., OPT, CPT, J1, etc.)",,Maybe,Potential (work-auth only),work_authorization_sponsorship,"Authorized to work in the United States and WILL NOT require future sponsorship, Work visa that will require future sponsorship (e.g., OPT, CPT, J1, etc.)",Midwest,True,,,
