company_id,record_ids,employer_name,fair_days,fair_day_count,is_multi_day_company,website,company_careers_website,description,positions_recruited,degree_levels_recruited,academic_years_recruited,academic_year_recruitment_notes,degrees_majors_recruited,work_authorization_sponsorship,work_authorization_notes,sponsorship_flag,sponsorship_status,sponsorship_basis,sponsorship_evidence,regions_recruited,accept_hardcopy_resumes,role_titles,role_source_url,role_last_checked
reliable_microsystems,reliable_microsystems__monday,Reliable Microsystems,Monday,1,False,https://reliablemicrosystems.com/,https://reliablemicrosystems.com/careers/,"Reliable MicroSystems is a Tennessee Limited Liability Company (LLC) founded in 2016 with offices in Franklin, Tennessee and Crane, Indiana. We provide IC chip design expertise to specialized industries, that are building systems for demanding applications.","Internship, Full-Time","Bachelors, Doctoral, Masters","First year undergraduate student, Fourth year + undergraduate student, Masters level student, Second year undergraduate student, Third year undergraduate student, Doctoral level student",All academic years may be recruited.,"Bachelors Aerospace Engineering, Bachelors Computer Engineering, Bachelors Engineering (undeclared), Bachelors Engineering Physics, Bachelors Nuclear Engineering and Radiological Sciences, Doctoral Aerospace Engineering, Doctoral Mechanical Engineering, Doctoral Electrical Engineering-Systems, Doctoral Electrical Engineering, Masters Aerospace Engineering, Masters Electrical Engineering, Masters Electrical Engineering-Systems, Masters Engineering Education Research, Masters Mechanical Engineering, Masters Nuclear Engineering and Radiological Sciences, Masters Space Engineering",Authorized to work in the United States and WILL NOT require future sponsorship,,No,No,default_no_explicit_sponsorship,Authorized to work in the United States and WILL NOT require future sponsorship,"Midwest, Southwest",False,,,
rippling,rippling__monday,Rippling,Monday,1,False,https://www.rippling.com/,https://www.rippling.com/en-GB/careers/open-roles,"Rippling gives businesses one place to run HR, IT, and Finance. It brings together all of the workforce systems that are normally scattered across a company, like payroll, expenses, benefits, and computers. For the first time ever, you can manage and automate every part of the employee lifecycle in a single system.","Co-op, Internship","Bachelors, Doctoral, Masters","Doctoral level student, Fourth year + undergraduate student, Masters level student, Third year undergraduate student",Rippling's internship program is geared towards conversion to full time. Students who are towards the end of their college career would benefit greatly by being able to turn their internship into a full time position after their internship.,"Bachelors Computer Science, Bachelors Computer Engineering, Bachelors Data Science, Masters Computer Science and Engineering, Doctoral Computer Science and Engineering","Authorized to work in the United States and WILL NOT require future sponsorship, Will need immediate sponsorship, Work visa that will require future sponsorship (e.g., OPT, CPT, J1, etc.)",We are able to provide sponsorship for F-1/OPT students as well as various other types of visas in the future.,Yes,Yes,work_authorization_notes,We are able to provide sponsorship for F-1/OPT students as well as various other types of visas in the future.,"West, Northeast, Midwest, Southeast, Southwest",True,,,
rocket,rocket__tuesday,Rocket,Tuesday,1,False,www.myrocketcareer.com,www.myrocketcareer.com,"Founded in 1985, Rocket is a Detroit-based fintech platform including mortgage, real estate, title and personal finance businesses: Rocket Mortgage, Rocket Homes, Rocket Close, Rocket Money and Rocket Loans.","Internship, Full-Time","Bachelors, Doctoral, Masters","Third year undergraduate student, Second year undergraduate student, Recent Alumni (up to two years post graduation), Fourth year + undergraduate student, Masters level student, First year undergraduate student, Doctoral level student",We recruit all years in school,"Bachelors Computer Science, Bachelors Data Science, Bachelors Engineering (undeclared), Doctoral Computer Science and Engineering, Doctoral Design Science, Masters Computer Science and Engineering, Masters Data Science, Masters Design Science","Authorized to work in the United States and WILL NOT require future sponsorship, Work visa that will require future sponsorship (e.g., OPT, CPT, J1, etc.)","We have the ability to sponsor, but it's on a case-by-case basis",Maybe,Case-by-case,work_authorization_notes,"We have the ability to sponsor, but it's on a case-by-case basis","Midwest, West, Remote work opportunities may be available",True,,,
rocket_lab_usa,rocket_lab_usa__monday,Rocket Lab USA,Monday,1,False,https://rocketlabcorp.com/careers/positions/,https://rocketlabcorp.com/careers/positions/,"Rocket Lab is a global leader in launch and space systems. The rockets and satellites we build and launch enable some of the most ambitious and vital space missions globally, supporting scientific exploration, Earth observation and missions to combat climate change, national security, and exciting new technology demonstrations.","Full-Time, Internship","Bachelors, Masters","Fourth year + undergraduate student, Masters level student, Third year undergraduate student",Spring and Summer 2026 recruitment,"Bachelors Aerospace Engineering, Bachelors Computer Engineering, Bachelors Computer Science, Bachelors Electrical Engineering, Bachelors Engineering, Bachelors Engineering Physics, Bachelors Mechanical Engineering, Bachelors Robotics, Bachelors Space Science and Engineering, Masters Aerospace Engineering, Masters Applied Physics, Masters Electrical Engineering, Masters Manufacturing, Masters Mechanical Engineering, Masters Naval Architecture and Marine Engineering, Masters Robotics, Masters Space Engineering, Masters Systems Engineering and Design, Masters Structural Engineering",Authorized to work in the United States and WILL NOT require future sponsorship,,No,No,default_no_explicit_sponsorship,Authorized to work in the United States and WILL NOT require future sponsorship,"West, Southwest, Southeast, Northeast, Midwest",True,,,
rolls_royce,rolls_royce__tuesday,Rolls-Royce,Tuesday,1,False,https://www.rolls-royce.com/,https://careers.rolls-royce.com/students-and-graduates,"For over 100 years, Rolls-Royce has powered, protected and connected the world through cutting-edge technology. From sustainable aviation to mission-critical technology, we're shaping the future on land, at sea and in the skies. We're always looking for bold thinkers to help us go further. Discover your potential, gain real-world experience, and create a career to be proud of at Rolls-Royce.","Co-op, Full-Time, Internship","Bachelors, Doctoral, Masters","Doctoral level student, First year undergraduate student, Fourth year + undergraduate student, Masters level student, Recent Alumni (up to two years post graduation), Third year undergraduate student, Second year undergraduate student",All years,"Bachelors Aerospace Engineering, Bachelors Chemical Engineering, Masters Aerospace Engineering, Doctoral Aerospace Engineering, Doctoral Chemical Engineering, Masters Chemical Engineering, Bachelors Computer Engineering, Doctoral Computer Science and Engineering, Masters Computer Science and Engineering, Doctoral Electrical and Computer Engineering, Bachelors Electrical Engineering, Doctoral Electrical Engineering, Doctoral Electrical Engineering-Systems, Masters Electrical and Computer Engineering, Masters Electrical Engineering, Masters Electrical Engineering-Systems, Doctoral Manufacturing, Masters Manufacturing, Bachelors Materials Science and Engineering, Doctoral Materials Science and Engineering, Masters Materials Science and Engineering, Bachelors Mechanical Engineering, Doctoral Mechanical Engineering, Masters Mechanical Engineering",Authorized to work in the United States and WILL NOT require future sponsorship,,No,No,default_no_explicit_sponsorship,Authorized to work in the United States and WILL NOT require future sponsorship,"Midwest, Northeast, Southeast, Southwest, West",False,,,
routeone,routeone__tuesday,Routeone,Tuesday,1,False,www.routeone.com,https://workforcenow.adp.com/mascsr/default/mdf/recruitment/recruitment.html?cid=2bc03731-0e10-40bd-a980-bea0d9de1afa&ccId=19000101_000001&type=MP&lang=en_US&selectedMenuKey=CareerCenter,"RouteOne is one of Metro Detroit's premiere FinTechs, dedicated to building streamlined solutions for the vehicle ﬁnance industry.",Internship,Bachelors,"Third year undergraduate student, Fourth year + undergraduate student",Looking for students that will be entering their Junior or Senior year in Fall of 2026.,"Bachelors Computer Engineering, Bachelors Computer Science, Bachelors Data Science, Bachelors Engineering (undeclared)",Authorized to work in the United States and WILL NOT require future sponsorship,,No,No,default_no_explicit_sponsorship,Authorized to work in the United States and WILL NOT require future sponsorship,Midwest,True,,,
rovisys,rovisys__tuesday,RoviSys,Tuesday,1,False,https://www.rovisys.com,https://www.rovisys.com/careers/,"RoviSys is a worldwide leader in automation and information solutions. For over 30 years, customers have relied on RoviSys to drive productivity, improve product quality, increase asset utilization and integrate technology. We’re committed to vendor independence, and our engineers deliver project & operational strategy, thought leadership, technical expertise, and dedicated customer service. RoviSys engineers make a difference. Every day.","Co-op, Full-Time, Internship","Bachelors, Masters","First year undergraduate student, Fourth year + undergraduate student, Masters level student, Recent Alumni (up to two years post graduation)",,"Bachelors Aerospace Engineering, Bachelors Biomedical Engineering, Bachelors Chemical Engineering, Bachelors Computer Engineering, Bachelors Electrical Engineering, Bachelors Industrial and Operations Engineering, Bachelors Mechanical Engineering, Masters Aerospace Engineering, Masters Biomedical Engineering, Masters Chemical Engineering, Masters Computer Science and Engineering, Masters Electrical and Computer Engineering, Masters Electrical Engineering, Masters Electrical Engineering-Systems, Masters Energy Systems Engineering, Masters Industrial and Operations Engineering, Masters Mechanical Engineering, Masters Systems Engineering and Design","Authorized to work in the United States and WILL NOT require future sponsorship, Work visa that will require future sponsorship (e.g., OPT, CPT, J1, etc.)",,Maybe,Potential (work-auth only),work_authorization_sponsorship,"Authorized to work in the United States and WILL NOT require future sponsorship, Work visa that will require future sponsorship (e.g., OPT, CPT, J1, etc.)","Midwest, Northeast, Southeast, Southwest, West",True,,,
ruby_associates_inc_structural_engineers_a_degenkolb_company,ruby_associates_inc_structural_engineers_a_degenkolb_company__monday,"Ruby+Associates, Inc. Structural Engineers, a Degenkolb Company",Monday,1,False,https://www.rubyandassociates.com/,https://www.rubyandassociates.com/,"Ruby+Associates, a Degenkolb Company, is a structural engineering firm devoted to serving the construction industry. We help our clients through our core services of Structural Building Design, Construction Engineering, Heavy Lift Engineering, Erection Engineering, Connection Design, Building Analysis/Reinforcement, and our LeanSteel®project delivery method. We serve top contractors, fabricators, erectors, and architects.","Full-Time, Internship","Bachelors, Doctoral, Masters","Doctoral level student, Fourth year + undergraduate student, Masters level student, Third year undergraduate student","Our interns must have had structural analysis, steel design, and concrete design classes. Some Juniors will fit these requirements, but mostly Seniors and up will. Our Designers must have at least a Master's degree in Civil/Structural Engineering. We do encourage Freshman, Sophomores, and Juniors to visit and learn about us.","Bachelors Civil Engineering, Doctoral Civil Engineering, Masters Civil Engineering",Authorized to work in the United States and WILL NOT require future sponsorship,Wee will consider sponsorship for PhD students who are researching in areas that are applicable to our projects.,Maybe,Case-by-case,work_authorization_notes,Wee will consider sponsorship for PhD students who are researching in areas that are applicable to our projects.,"Midwest, West",True,,,
sc_johnson,sc_johnson__monday,SC Johnson,Monday,1,False,https://www.scjohnson.com/,https://jobs.scjohnson.com/,"SC Johnson is an industry-leading CPG company home to many of the world’s favorite household brands such as Windex and Ziploc. We’re a private, global, family-owned company, centrally located between Milwaukee and Chicago our global HQ is located in Racine, WI, where we were founded. With operations in more than 70 countries, our products are sold in virtually every country.",Internship,Bachelors,"Third year undergraduate student, Second year undergraduate student","Speaking with Freshman, Sophomores, and Juniors about opportunities with SC Johnson","Bachelors Chemical Engineering, Bachelors Computer Science, Bachelors Data Science, Bachelors Electrical Engineering, Bachelors Industrial and Operations Engineering, Bachelors Mechanical Engineering",Authorized to work in the United States and WILL NOT require future sponsorship,,No,No,default_no_explicit_sponsorship,Authorized to work in the United States and WILL NOT require future sponsorship,Midwest,False,,,
scalp_trade,scalp_trade__monday,SCALP Trade,Monday,1,False,https://scalptrade.com/,https://scalptrade.com/careers,"SCALP Trade is a group of driven and dynamic individuals focused on deep problem solving, with the desire to be a positive force in the capital markets. We are a privately-funded company that is owned and managed by trading professionals who have set high standards around trust, leadership and integrity, we have an absolute commitment to doing it right. Our casual atmosphere, culture of continuous learning, innovation, and philosophy of rewarding outstanding performance based on merit rather than tenure or title has attracted brilliant people from different backgrounds. At SCALP Trade we value our people and pride ourselves on diversity.","Full-Time, Internship","Bachelors, Doctoral, Masters","Third year undergraduate student, Fourth year + undergraduate student, Masters level student, Doctoral level student",We are currently seeking incoming juniors and seniors for internships and full time roles.,"Bachelors Aerospace Engineering, Bachelors Biomedical Engineering, Bachelors Chemical Engineering, Bachelors Civil Engineering, Bachelors Climate and Meteorology, Bachelors Computer Engineering, Bachelors Computer Science, Bachelors Data Science, Bachelors Electrical Engineering, Bachelors Engineering, Bachelors Engineering (undeclared), Bachelors Engineering Physics, Bachelors Environmental Engineering, Bachelors Industrial and Operations Engineering, Bachelors Materials Science and Engineering, Bachelors Mechanical Engineering, Bachelors Naval Architecture and Marine Engineering, Bachelors Nuclear Engineering and Radiological Sciences, Bachelors Robotics, Bachelors Space Science and Engineering, Doctoral Aerospace Engineering, Doctoral Applied Physics, Doctoral Atmospheric Oceanic and Space Sciences, Doctoral Biomedical Engineering, Doctoral Chemical Engineering, Doctoral Civil Engineering, Doctoral Climate and Space Sciences and Engineering, Doctoral Computer Science and Engineering, Doctoral Design Science, Doctoral Electrical and Computer Engineering, Doctoral Electrical Engineering, Doctoral Electrical Engineering-Systems, Doctoral Engineering Education Research, Doctoral Environmental Engineering, Doctoral Industrial and Operations Engineering, Doctoral Macromolecular Science and Engineering, Doctoral Manufacturing, Doctoral Materials Science and Engineering, Doctoral Mechanical Engineering, Doctoral Naval Architecture and Marine Engineering, Doctoral Nuclear Engineering and Radiological Sciences, Doctoral Robotics, Masters Advanced Medical Product Engineering & Development, Masters Aerospace Engineering, Masters Applied Climate, Masters Applied Physics, Masters Automotive Engineering, Masters Biomedical Engineering, Masters Chemical Engineering, Masters Civil Engineering, Masters Climate and Space Sciences and Engineering, Masters Computer Science and Engineering, Masters Construction Engineering and Management, Masters Data Science, Masters Design Science, Masters Electrical and Computer Engineering, Masters Electrical Engineering, Masters Electrical Engineering-Systems, Masters Energy Systems Engineering, Masters Engineering Education Research, Masters Environmental Engineering, Masters Global Automotive and Manufacturing Engineering, Masters Industrial and Operations Engineering, Masters Macromolecular Science and Engineering, Masters Manufacturing, Masters Materials Science and Engineering, Masters Mechanical Engineering, Masters Naval Architecture and Marine Engineering, Masters Nuclear Engineering and Radiological Sciences, Masters Robotics, Masters Smart Infrastructure Finance, Masters Space Engineering, Masters Structural Engineering, Masters Systems Engineering and Design",Authorized to work in the United States and WILL NOT require future sponsorship,,No,No,default_no_explicit_sponsorship,Authorized to work in the United States and WILL NOT require future sponsorship,"Midwest, Southeast, Northeast",True,,,
sick,sick__monday,SICK,Monday,1,False,https://www.sick.com/us/en/,https://www.sick.com/us/en/company/careers-at-sick/w/careers-listings,"From factory automation to logistics automation – sensor solutions from SICK are keeping industry moving. As a technology and market leader, SICK provides sensor intelligence and application solutions that create the perfect basis for controlling processes securely and efficiently, protecting individuals from accidents, and preventing damage to the environment.","Full-Time, Internship","Bachelors, Masters","Masters level student, Fourth year + undergraduate student, Third year undergraduate student, Second year undergraduate student",Student opportunities are open to second year students and above.,"Bachelors Computer Engineering, Bachelors Computer Science, Bachelors Electrical Engineering, Bachelors Industrial and Operations Engineering, Bachelors Mechanical Engineering, Bachelors Robotics, Masters Computer Science and Engineering, Masters Electrical and Computer Engineering, Masters Electrical Engineering, Masters Robotics, Masters Mechanical Engineering",Authorized to work in the United States and WILL NOT require future sponsorship,All student and entry-level opportunities are not open for sponsorship.,No,No,work_authorization_notes,All student and entry-level opportunities are not open for sponsorship.,"Midwest, Northeast, West, Remote work opportunities may be available",False,,,
smart_scholarship,smart_scholarship__monday,SMART Scholarship,Monday,1,False,https://www.smartscholarship.org/smart,https://www.smartscholarship.org/smart,"The SMART Scholarship-for-Service Program is a unique opportunity for science, technology, engineering, and mathematics (STEM) students to advance their education and jumpstart their careers. SMART provides merit-based scholarships to bachelor's, master's, and doctoral students pursuing STEM degrees. SMART scholarship recipients receive full tuition, annual stipends, summer internships, and after graduation, civilian employment with the Department of Defense. Applications are open annually from August 1 to the first Friday in December.","Full-Time, Internship","Bachelors, Doctoral, Masters","First year undergraduate student, Fourth year + undergraduate student, Masters level student, Doctoral level student, Second year undergraduate student, Third year undergraduate student",,"Bachelors Aerospace Engineering, Bachelors Biomedical Engineering, Bachelors Chemical Engineering, Bachelors Civil Engineering, Bachelors Computer Engineering, Bachelors Computer Science, Bachelors Data Science, Bachelors Electrical Engineering, Bachelors Engineering Physics, Bachelors Industrial and Operations Engineering, Bachelors Materials Science and Engineering, Bachelors Mechanical Engineering, Masters Aerospace Engineering, Masters Applied Physics, Masters Automotive Engineering, Masters Biomedical Engineering, Masters Chemical Engineering, Masters Civil Engineering, Masters Computer Science and Engineering, Masters Data Science, Masters Electrical Engineering, Masters Mechanical Engineering, Bachelors Robotics, Masters Industrial and Operations Engineering, Masters Electrical and Computer Engineering, Masters Robotics, Doctoral Aerospace Engineering, Doctoral Applied Physics, Doctoral Biomedical Engineering, Doctoral Chemical Engineering, Doctoral Civil Engineering, Doctoral Computer Science and Engineering, Doctoral Electrical and Computer Engineering, Doctoral Electrical Engineering, Doctoral Industrial and Operations Engineering, Doctoral Materials Science and Engineering, Doctoral Mechanical Engineering, Doctoral Robotics",Authorized to work in the United States and WILL NOT require future sponsorship,,No,No,default_no_explicit_sponsorship,Authorized to work in the United States and WILL NOT require future sponsorship,"Midwest, Northeast, Southeast, Southwest, West",False,,,
sandia_national_laboratories,sandia_national_laboratories__monday | sandia_national_laboratories__tuesday,Sandia National Laboratories,"Monday, Tuesday, Monday;Tuesday",2,True,https://www.sandia.gov/,https://sandia.jobs/,"For over 75 years, Sandia has delivered essential science and technology to resolve the nation's most challenging security issues. A strong science, technology, and engineering foundation enables our mission through a capable research staff working at the forefront of innovation, collaborative research with universities & companies, and discretionary research projects with significant potential impact. In keeping with our vision to be the nation's premier science and engineering laboratory for national security and technology innovation, we recruit the best and the brightest, equip them with world-class research tools & facilities, and provide opportunities to collaborate with technical experts from many different scientific disciplines.",Internship,"Bachelors, Doctoral, Masters","Doctoral level student, First year undergraduate student, Fourth year + undergraduate student, Masters level student, Second year undergraduate student, Third year undergraduate student | Doctoral level student, First year undergraduate student, Fourth year + undergraduate student, Masters level student, Recent Alumni (up to two years post graduation), Second year undergraduate student, Third year undergraduate student",,"Bachelors Aerospace Engineering, Bachelors Chemical Engineering, Bachelors Computer Engineering, Bachelors Computer Science, Bachelors Data Science, Bachelors Electrical Engineering, Bachelors Engineering Physics, Bachelors Materials Science and Engineering, Bachelors Mechanical Engineering, Bachelors Nuclear Engineering and Radiological Sciences, Bachelors Robotics, Doctoral Aerospace Engineering, Doctoral Applied Physics, Doctoral Chemical Engineering, Doctoral Computer Science and Engineering, Doctoral Design Science, Doctoral Electrical and Computer Engineering, Doctoral Electrical Engineering, Doctoral Electrical Engineering-Systems, Doctoral Materials Science and Engineering, Doctoral Mechanical Engineering, Doctoral Nuclear Engineering and Radiological Sciences, Doctoral Robotics, Masters Aerospace Engineering, Masters Applied Physics, Masters Chemical Engineering, Masters Computer Science and Engineering, Masters Data Science, Masters Design Science, Masters Electrical and Computer Engineering, Masters Electrical Engineering, Masters Electrical Engineering-Systems, Masters Energy Systems Engineering, Masters Materials Science and Engineering, Masters Mechanical Engineering, Masters Nuclear Engineering and Radiological Sciences, Masters Robotics, Masters Structural Engineering",Authorized to work in the United States and WILL NOT require future sponsorship,"Most roles at Sandia require a U.S. DOE Security Clearance, which requires U.S. Citizenship",No,No,work_authorization_notes,"Most roles at Sandia require a U.S. DOE Security Clearance, which requires U.S. Citizenship","West, Southwest | Southwest, West",False,,,
