company_id,record_ids,employer_name,fair_days,fair_day_count,is_multi_day_company,website,company_careers_website,description,positions_recruited,degree_levels_recruited,academic_years_recruited,academic_year_recruitment_notes,degrees_majors_recruited,work_authorization_sponsorship,work_authorization_notes,sponsorship_flag,sponsorship_status,sponsorship_basis,sponsorship_evidence,regions_recruited,accept_hardcopy_resumes,role_titles,role_source_url,role_last_checked
ey,ey__tuesday,EY,Tuesday,1,False,https://www.ey.com/en_us,https://www.ey.com/en_us/careers/students-and-entry-level-professionals,"Explore what’s possible on EY teams and across EY services. We’re nearly 300,000 global perspectives ready to welcome yours. To get started, visit ey.com/us/students to learn more about what you can do here, what it’s like to work here and how to join us.","Full-Time, Internship","Masters, Bachelors","Second year undergraduate student, Fourth year + undergraduate student, Masters level student",Summer 2026 Internship,"Bachelors Computer Science, Bachelors Computer Engineering, Masters Computer Science and Engineering, Bachelors Data Science, Masters Data Science","Work visa that will require future sponsorship (e.g., OPT, CPT, J1, etc.), Authorized to work in the United States and WILL NOT require future sponsorship","EY provides equal employment opportunities to applicants and employees without regard to race, color, religion, age, sex, sexual orientation, gender identity/expression, pregnancy, genetic information, national origin, protected veteran status, disability status, or any other legally protected basis, including arrest and conviction records, in accordance with applicable law.",Maybe,Potential (work-auth only),work_authorization_sponsorship,"Work visa that will require future sponsorship (e.g., OPT, CPT, J1, etc.), Authorized to work in the United States and WILL NOT require future sponsorship","Midwest, Northeast, Southeast, Southwest, West",False,,,
eaton,eaton__monday,Eaton,Monday,1,False,www.eaton.com/careers,www.eaton.com/careers,"Eaton is an intelligent power management company dedicated to improving the quality of life and protecting the environment for people everywhere. We are guided by our commitment to do business right, to operate sustainably and to help our customers manage power ─ today and well into the future. By capitalizing on the global growth trends of electrification and digitalization, we’re accelerating the planet’s transition to renewable energy, helping to solve the world’s most urgent power management challenges, and doing what’s best for our stakeholders and all of society.","Co-op, Full-Time, Internship","Bachelors, Masters","Third year undergraduate student, Second year undergraduate student, Masters level student, Fourth year + undergraduate student","Sophomore, Junior, Senior, Masters","Bachelors Aerospace Engineering, Bachelors Computer Engineering, Bachelors Computer Science, Bachelors Electrical Engineering, Bachelors Industrial and Operations Engineering, Bachelors Mechanical Engineering, Masters Aerospace Engineering, Masters Computer Science and Engineering, Masters Electrical and Computer Engineering, Masters Electrical Engineering, Masters Industrial and Operations Engineering, Masters Mechanical Engineering",Authorized to work in the United States and WILL NOT require future sponsorship,,No,No,default_no_explicit_sponsorship,Authorized to work in the United States and WILL NOT require future sponsorship,"West, Southwest, Southeast, Northeast, Midwest",False,,,
eli_lilly_and_company,eli_lilly_and_company__monday,Eli Lilly and Company,Monday,1,False,https://www.lilly.com,careers.lilly.com,We’re a medicine company turning science into healing to make life better for people around the world.,Internship,Bachelors,"Second year undergraduate student, Third year undergraduate student",,"Bachelors Biomedical Engineering, Bachelors Chemical Engineering, Bachelors Computer Engineering, Bachelors Computer Science, Bachelors Data Science, Bachelors Electrical Engineering, Bachelors Engineering, Bachelors Engineering Physics, Bachelors Materials Science and Engineering, Bachelors Mechanical Engineering, Bachelors Nuclear Engineering and Radiological Sciences",Authorized to work in the United States and WILL NOT require future sponsorship,,No,No,default_no_explicit_sponsorship,Authorized to work in the United States and WILL NOT require future sponsorship,"Midwest, Southeast, West",False,,,
engineering_systems_inc_esi,engineering_systems_inc_esi__monday,Engineering Systems Inc. (ESi),Monday,1,False,www.engsys.com,https://www.engsys.com/people/careers/,"Engineering Systems Inc. (ESi) is a multidisciplinary engineering and scientific investigation and failure analysis firm. We primarily work with law firms, insurance companies, government agencies, and manufacturers on small to large-scale projects to answer any technical questions they have.","Full-Time, Internship, Co-op","Bachelors, Doctoral, Masters","Fourth year + undergraduate student, Masters level student, Second year undergraduate student, Third year undergraduate student, First year undergraduate student, Doctoral level student",,"Bachelors Aerospace Engineering, Bachelors Engineering Physics, Bachelors Mechanical Engineering, Bachelors Naval Architecture and Marine Engineering, Bachelors Robotics, Doctoral Aerospace Engineering, Doctoral Applied Physics, Doctoral Electrical Engineering, Doctoral Mechanical Engineering, Doctoral Naval Architecture and Marine Engineering, Masters Aerospace Engineering, Masters Applied Physics, Masters Automotive Engineering, Masters Electrical Engineering, Masters Electrical Engineering-Systems, Doctoral Electrical Engineering-Systems, Bachelors Electrical Engineering, Masters Mechanical Engineering, Masters Robotics, Masters Naval Architecture and Marine Engineering",Authorized to work in the United States and WILL NOT require future sponsorship,,No,No,default_no_explicit_sponsorship,Authorized to work in the United States and WILL NOT require future sponsorship,"Midwest, Southeast, West, Northeast, Southwest",True,,,
epic,epic__tuesday,Epic,Tuesday,1,False,https://www.epic.com/,https://careers.epic.com/,"Epic is a global leader in healthcare tech. We hire smart and motivated people from all academic majors to code, test, implement, and support healthcare software that improves care and save lives. Our team collaborates with some of the world’s most respected healthcare organizations to improve patient care and the health of entire communities.","Full-Time, Internship","Bachelors, Masters","Fourth year + undergraduate student, Masters level student","Junior, Senior, Masters","Bachelors Aerospace Engineering, Bachelors Biomedical Engineering, Bachelors Chemical Engineering, Bachelors Civil Engineering, Bachelors Climate and Meteorology, Bachelors Computer Engineering, Bachelors Computer Science, Bachelors Data Science, Bachelors Electrical Engineering, Bachelors Engineering (undeclared), Bachelors Engineering Physics, Bachelors Environmental Engineering, Bachelors Industrial and Operations Engineering, Bachelors Materials Science and Engineering, Bachelors Mechanical Engineering, Bachelors Naval Architecture and Marine Engineering, Bachelors Nuclear Engineering and Radiological Sciences, Bachelors Robotics, Bachelors Space Science and Engineering, Doctoral Aerospace Engineering, Doctoral Applied Physics, Doctoral Atmospheric Oceanic and Space Sciences, Doctoral Biomedical Engineering, Doctoral Chemical Engineering, Doctoral Civil Engineering, Doctoral Climate and Space Sciences and Engineering, Doctoral Computer Science and Engineering, Doctoral Design Science, Doctoral Electrical and Computer Engineering, Doctoral Electrical Engineering, Doctoral Electrical Engineering-Systems, Doctoral Engineering Education Research, Doctoral Environmental Engineering, Doctoral Industrial and Operations Engineering, Doctoral Macromolecular Science and Engineering, Doctoral Manufacturing, Doctoral Materials Science and Engineering, Doctoral Mechanical Engineering, Doctoral Naval Architecture and Marine Engineering, Doctoral Nuclear Engineering and Radiological Sciences, Doctoral Robotics, Masters Advanced Medical Product Engineering & Development, Masters Aerospace Engineering, Masters Applied Climate, Masters Applied Physics, Masters Automotive Engineering, Masters Biomedical Engineering, Masters Chemical Engineering, Masters Civil Engineering, Masters Climate and Space Sciences and Engineering, Masters Computer Science and Engineering, Masters Construction Engineering and Management, Masters Data Science, Masters Design Science, Masters Electrical and Computer Engineering, Masters Electrical Engineering, Masters Electrical Engineering-Systems, Masters Energy Systems Engineering, Masters Engineering Education Research, Masters Environmental Engineering, Masters Global Automotive and Manufacturing Engineering, Masters Industrial and Operations Engineering, Masters Macromolecular Science and Engineering, Masters Manufacturing, Masters Materials Science and Engineering, Masters Mechanical Engineering, Masters Naval Architecture and Marine Engineering, Masters Nuclear Engineering and Radiological Sciences, Masters Robotics, Masters Smart Infrastructure Finance, Masters Space Engineering, Masters Structural Engineering, Masters Systems Engineering and Design",Authorized to work in the United States and WILL NOT require future sponsorship,,No,No,default_no_explicit_sponsorship,Authorized to work in the United States and WILL NOT require future sponsorship,"Midwest, Northeast, Southeast, Southwest, West",True,,,
epirus,epirus__tuesday,Epirus,Tuesday,1,False,https://www.epirusinc.com/,https://www.epirusinc.com/careers,We are looking for Interns for our 2026 Summer Class,"Full-Time, Internship","Bachelors, Doctoral, Masters","Doctoral level student, First year undergraduate student, Fourth year + undergraduate student, Masters level student, Recent Alumni (up to two years post graduation), Second year undergraduate student, Third year undergraduate student",For our internships we look for juniors,"Bachelors Aerospace Engineering, Bachelors Computer Engineering, Bachelors Computer Science, Bachelors Electrical Engineering, Bachelors Engineering (undeclared), Bachelors Engineering Physics, Bachelors Industrial and Operations Engineering, Bachelors Mechanical Engineering, Bachelors Robotics, Bachelors Space Science and Engineering, Doctoral Aerospace Engineering, Doctoral Applied Physics, Doctoral Computer Science and Engineering, Doctoral Design Science, Doctoral Electrical and Computer Engineering, Doctoral Electrical Engineering, Doctoral Electrical Engineering-Systems, Doctoral Materials Science and Engineering, Doctoral Manufacturing, Masters Applied Physics, Bachelors Data Science, Bachelors Materials Science and Engineering, Doctoral Atmospheric Oceanic and Space Sciences, Doctoral Civil Engineering, Doctoral Climate and Space Sciences and Engineering, Doctoral Industrial and Operations Engineering, Doctoral Macromolecular Science and Engineering, Doctoral Mechanical Engineering, Doctoral Robotics, Masters Aerospace Engineering, Masters Automotive Engineering, Masters Chemical Engineering, Masters Civil Engineering, Masters Climate and Space Sciences and Engineering, Masters Computer Science and Engineering, Masters Construction Engineering and Management, Masters Data Science, Masters Design Science, Masters Electrical and Computer Engineering, Masters Electrical Engineering, Masters Electrical Engineering-Systems, Masters Manufacturing, Masters Materials Science and Engineering, Masters Mechanical Engineering, Masters Robotics, Masters Space Engineering, Masters Structural Engineering, Masters Systems Engineering and Design",Authorized to work in the United States and WILL NOT require future sponsorship,,No,No,default_no_explicit_sponsorship,Authorized to work in the United States and WILL NOT require future sponsorship,West,True,,,
esteco_north_america_inc,esteco_north_america_inc__monday,Esteco North America Inc.,Monday,1,False,http://www.esteco.com,http://www.esteco.com,"ESTECO is an independent software vendor who develops digital engineering technology for MDAO (multidisciplinary design analysis & optimization) and SPDM (simulation process data management). Its COTS products VOLTA and modeFRONTIER are used to integrate and automate simulation workflows, conduct design of experiments, trade - and numerical optimization studies, and collaborate among geographically dispersed engineering teams.","Co-op, Full-Time, Internship","Bachelors, Masters","Fourth year + undergraduate student, Masters level student",,"Bachelors Aerospace Engineering, Bachelors Computer Engineering, Bachelors Mechanical Engineering, Masters Aerospace Engineering, Masters Computer Science and Engineering, Masters Mechanical Engineering","Authorized to work in the United States and WILL NOT require future sponsorship, Work visa that will require future sponsorship (e.g., OPT, CPT, J1, etc.)",May provide sponsorship depending on company need and available position.,Maybe,Case-by-case,work_authorization_notes,May provide sponsorship depending on company need and available position.,"Midwest, Remote work opportunities may be available",True,,,
expedia_group,expedia_group__tuesday,Expedia Group,Tuesday,1,False,https://expediagroup.com/,https://careers.expediagroup.com/,"We are travelers and technologists. We work across time zones, hemispheres, cultures and languages. We’re used to breaking things down and building them back up again, until they’re even better. We know travel can be hard, but we also know that it’s worth it, every time. And because we believe travel is a force for good, we take our roles seriously. We’re here to build great products, and facilitate connections between travelers and our partners that truly bring good into the world.","Internship, Full-Time","Bachelors, Masters","Third year undergraduate student, Fourth year + undergraduate student, Masters level student",Internships are available for current Juniors,"Bachelors Computer Engineering, Bachelors Computer Science, Bachelors Data Science","Authorized to work in the United States and WILL NOT require future sponsorship, Work visa that will require future sponsorship (e.g., OPT, CPT, J1, etc.)",Able to sponsor for technical roles,Maybe,Limited,work_authorization_notes,Able to sponsor for technical roles,West,False,,,
exxonmobil,exxonmobil__monday,ExxonMobil,Monday,1,False,https://corporate.exxonmobil.com/,https://jobs.exxonmobil.com/ExxonMobil/job/Houston-Engineering-Students-Seeking-Full-Time-Employment-TX-77001/1314845500/ https://jobs.exxonmobil.com/ExxonMobil/job/Houston-Engineering-Students-Seeking-Internship-Co-op-Opportunities-TX-77001/1314842000/ https://jobs.exxonmobil.com/ExxonMobil/job/Houston-PhD-Students-Seeking-Full-Time-Employment-TX-77001/1314976300/ https://jobs.exxonmobil.com/ExxonMobil/job/Houston-PhD-Students-Seeking-Internship-Opportunities-TX-77001/1314973500/,"ExxonMobil, one of the world’s largest publicly traded energy providers and chemical manufacturers, develops and applies next-generation technologies to help safely and responsibly meet the world’s growing needs for energy and high-quality chemical products.","Co-op, Full-Time, Internship","Bachelors, Doctoral, Masters","Doctoral level student, Second year undergraduate student, Third year undergraduate student, Masters level student, Fourth year + undergraduate student, First year undergraduate student",,"Bachelors Chemical Engineering, Bachelors Civil Engineering, Bachelors Data Science, Bachelors Engineering, Bachelors Engineering (undeclared), Bachelors Environmental Engineering, Bachelors Mechanical Engineering, Doctoral Chemical Engineering, Masters Chemical Engineering, Masters Data Science, Masters Energy Systems Engineering, Masters Environmental Engineering, Masters Mechanical Engineering, Masters Systems Engineering and Design, Bachelors Electrical Engineering, Bachelors Industrial and Operations Engineering, Bachelors Materials Science and Engineering, Doctoral Civil Engineering, Masters Civil Engineering, Masters Construction Engineering and Management, Masters Electrical Engineering, Masters Electrical Engineering-Systems, Masters Electrical and Computer Engineering, Masters Industrial and Operations Engineering, Masters Manufacturing, Masters Materials Science and Engineering, Masters Structural Engineering, Doctoral Electrical Engineering, Doctoral Environmental Engineering, Doctoral Industrial and Operations Engineering, Doctoral Manufacturing, Doctoral Materials Science and Engineering, Doctoral Mechanical Engineering",Authorized to work in the United States and WILL NOT require future sponsorship,Able to sponsor for some PhD level positions only,Maybe,Limited,work_authorization_notes,Able to sponsor for some PhD level positions only,"Southeast, Midwest, Southwest, West",True,,,
fanuc_america_corporation,fanuc_america_corporation__tuesday,FANUC America Corporation,Tuesday,1,False,https://www.fanucamerica.com/,https://myjobs.adp.com/fanuc/cx,"FANUC is the global leader in CNC systems, robotics, and ROBOMACHINEs with over 40 million products installed worldwide.",Internship,Bachelors,"Second year undergraduate student, Third year undergraduate student",,"Bachelors Engineering, Bachelors Computer Engineering",Authorized to work in the United States and WILL NOT require future sponsorship,,No,No,default_no_explicit_sponsorship,Authorized to work in the United States and WILL NOT require future sponsorship,Midwest,True,,,
fk_engineering_associates,fk_engineering_associates__monday,FK Engineering Associates,Monday,1,False,www.fkengineering.com,http://fkengineering.com/careers/,"FK Engineering Associates was founded in 2012 and has quickly grown to include some of the foremost underground engineering professionals in southeast Michigan and across the Midwest. Our engineers have led underground engineering investigations and design for many large public works and industrial projects locally and across the country. These have included large diameter tunnels and shafts, major bridges and interchanges, landfills, and industrial development. FK Engineering Associates strives to create an atmosphere of value, growth and empowerment. Teamwork is key to our success in creating a positive environment for our employees and providing outstanding service to our clients.","Full-Time, Internship","Bachelors, Doctoral, Masters","Doctoral level student, Fourth year + undergraduate student, Masters level student, Third year undergraduate student",,"Bachelors Civil Engineering, Doctoral Civil Engineering, Masters Civil Engineering",Authorized to work in the United States and WILL NOT require future sponsorship,,No,No,default_no_explicit_sponsorship,Authorized to work in the United States and WILL NOT require future sponsorship,Northeast,True,,,
freudenberg,freudenberg__monday,FREUDENBERG,Monday,1,False,www.freudenberg.com,www.freudenberg.com/careers,"Freudenberg is a global technology group that develops innovative solutions for around 40 markets, including seals, filters, medical products, and technical textiles. With a strong focus on customer orientation, diversity, and team spirit, the company employs over 52,000 people in 60 countries and generated more than €11.95 billion in sales in 2024.",Full-Time,"Doctoral, Masters, Bachelors","Doctoral level student, Masters level student, Fourth year + undergraduate student",,"Bachelors Chemical Engineering, Bachelors Civil Engineering, Bachelors Computer Engineering, Bachelors Computer Science, Bachelors Data Science, Bachelors Electrical Engineering, Bachelors Engineering (undeclared), Bachelors Engineering Physics, Bachelors Industrial and Operations Engineering, Bachelors Materials Science and Engineering, Bachelors Mechanical Engineering, Doctoral Biomedical Engineering, Doctoral Chemical Engineering, Doctoral Civil Engineering, Doctoral Climate and Space Sciences and Engineering, Doctoral Computer Science and Engineering, Doctoral Electrical and Computer Engineering, Doctoral Electrical Engineering, Doctoral Electrical Engineering-Systems, Doctoral Manufacturing, Doctoral Materials Science and Engineering, Doctoral Mechanical Engineering, Masters Advanced Medical Product Engineering & Development, Masters Automotive Engineering, Masters Biomedical Engineering, Masters Chemical Engineering, Masters Civil Engineering, Masters Computer Science and Engineering, Masters Construction Engineering and Management, Masters Data Science, Masters Electrical and Computer Engineering, Masters Electrical Engineering, Masters Electrical Engineering-Systems, Masters Energy Systems Engineering, Masters Global Automotive and Manufacturing Engineering, Masters Industrial and Operations Engineering, Masters Manufacturing, Masters Materials Science and Engineering, Masters Mechanical Engineering, Masters Structural Engineering, Masters Systems Engineering and Design","Authorized to work in the United States and WILL NOT require future sponsorship, Work visa that will require future sponsorship (e.g., OPT, CPT, J1, etc.)",It depends on the positions,Maybe,Case-by-case,work_authorization_notes,It depends on the positions,"Midwest, Northeast, Remote work opportunities may be available, Southeast, Southwest, West",True,,,
findorff,findorff__monday,Findorff,Monday,1,False,https://www.findorff.com/,https://www.findorff.com/careers/,"Founded in 1890, Findorff is one of the Midwest's leading builders. The company employs nearly 1,300 construction professionals and tradespeople, and has completed $1.2 billion in construction in 2023. With offices in Madison, Milwaukee, and Wausau WI, Findorff specializes in new construction, additions, remodels, tenant build-outs, historic renovations, and sustainable building projects of all sizes. Findorff has a travel group that has the opportunity to work on projects throughout the United States; currently in Tempe, AZ, Ann Arbor, MI and Cincinnati, OH.","Co-op, Full-Time","Bachelors, Masters","Second year undergraduate student, Third year undergraduate student, Masters level student, Fourth year + undergraduate student",,"Bachelors Civil Engineering, Bachelors Engineering, Bachelors Industrial and Operations Engineering, Bachelors Mechanical Engineering, Masters Civil Engineering",Authorized to work in the United States and WILL NOT require future sponsorship,,No,No,default_no_explicit_sponsorship,Authorized to work in the United States and WILL NOT require future sponsorship,Midwest,True,,,
five_rings,five_rings__tuesday,Five Rings,Tuesday,1,False,https://fiverings.com/,https://fiverings.com/careers/,"Five Rings is a NYC-based proprietary trading firm founded with a vision of combining strategy, innovation and technology to succeed in today’s global markets. We work in teams - Quants, Developers, Traders - continuously designing and optimizing.","Full-Time, Internship","Bachelors, Masters","First year undergraduate student, Second year undergraduate student, Third year undergraduate student, Fourth year + undergraduate student, Masters level student",,"Bachelors Chemical Engineering, Bachelors Computer Engineering, Bachelors Computer Science, Bachelors Data Science, Bachelors Electrical Engineering, Bachelors Engineering (undeclared), Bachelors Engineering Physics, Masters Chemical Engineering, Masters Computer Science and Engineering, Masters Data Science, Masters Design Science, Masters Electrical and Computer Engineering, Masters Electrical Engineering, Masters Electrical Engineering-Systems, Masters Mechanical Engineering","Authorized to work in the United States and WILL NOT require future sponsorship, Will need immediate sponsorship, Work visa that will require future sponsorship (e.g., OPT, CPT, J1, etc.)",Five Rings is able to provide US visa sponsorship.,Yes,Yes,work_authorization_notes,Five Rings is able to provide US visa sponsorship.,"Northeast, Outside of the U.S.",False,,,
flowserve,flowserve__tuesday,Flowserve,Tuesday,1,False,https://www.flowserve.com,https://www.flowserve.com/en/careers/,"Flowserve is a world-leading manufacturer and aftermarket service provider of comprehensive flow control systems. We are committed to building a more sustainable future to make the world better for everyone. With 16,000+ employees in 50+ countries, we combine our global reach with local presence. We invite you to put your talents and career in motion at Flowserve.",Full-Time,Bachelors,Fourth year + undergraduate student,Recruiting those graduating in May 2026 seeking full-time roles with a July 2026 start date.,"Bachelors Industrial and Operations Engineering, Bachelors Mechanical Engineering, Bachelors Materials Science and Engineering, Bachelors Chemical Engineering, Bachelors Nuclear Engineering and Radiological Sciences",Authorized to work in the United States and WILL NOT require future sponsorship,Unable to sponsor,No,No,work_authorization_notes,Unable to sponsor,"Midwest, Northeast, Southeast",False,,,
